{
  "manifest_version": "0.1.0",
  "adapter": {
    "name": "traccar",
    "version": "0.1.0",
    "source_versions": [
      "6.x"
    ],
    "provenance": "vendor_documentation_public"
  },
  "identity": {
    "basis": "vendor_event_id",
    "byte_identical_resends": false
  },
  "times": {
    "precedence": [
      "received_at",
      "vendor_received_at",
      "device_time"
    ],
    "device_clock_trusted": false
  },
  "delivery": {
    "mechanisms": [
      "raw_forward",
      "webhook"
    ],
    "push_reliability": "best_effort",
    "pull_reconciler": true,
    "second_server_mode": "none",
    "buffering": {
      "offline_buffer": true,
      "backfill_marked": false
    },
    "normal_delay_s": 2,
    "worst_case_delay_s": 900
  },
  "write_time_destruction": [
    {
      "setting": "filter.past",
      "effect": "discards positions older than the configured threshold before storage; no export can recover them",
      "default_enabled": false
    }
  ],
  "retention": {
    "raw_days": null,
    "decoded_days": null,
    "customer_reducible": true,
    "notes": "self-hosted; retention is whatever the operator configures"
  },
  "fields": [
    {
      "path": "position.lat",
      "support": "supported"
    },
    {
      "path": "position.lon",
      "support": "supported"
    },
    {
      "path": "position.valid",
      "support": "supported"
    },
    {
      "path": "position.hdop",
      "support": "conditional",
      "condition": "present when the device protocol reports hdop; OsmAnd does, many do not"
    },
    {
      "path": "motion.speed_kph",
      "support": "supported"
    },
    {
      "path": "motion.heading_deg",
      "support": "supported"
    },
    {
      "path": "motion.ignition",
      "support": "conditional",
      "condition": "present only when the device protocol reports an ignition attribute"
    },
    {
      "path": "motion.motion_state",
      "support": "conditional",
      "condition": "derived from Traccar's computed motion attribute, not from the device"
    },
    {
      "path": "motion.odometer_m",
      "support": "conditional",
      "condition": "Traccar's totalDistance is server-computed unless the device reports odometer"
    },
    {
      "path": "power.internal_pct",
      "support": "conditional",
      "condition": "present when the device reports battery level"
    },
    {
      "path": "power.external_v",
      "support": "conditional",
      "condition": "device-dependent; absent on protocols without a power attribute"
    },
    {
      "path": "power.external_state",
      "support": "conditional",
      "condition": "derived from Traccar's charge attribute where the device reports it"
    },
    {
      "path": "network.cell_id",
      "support": "conditional",
      "condition": "device-dependent; many protocols omit cell identity entirely"
    },
    {
      "path": "device.sleep_state",
      "support": "unsupported"
    },
    {
      "path": "device.firmware",
      "support": "conditional",
      "condition": "present only when the device reports a version attribute"
    }
  ],
  "readiness": {
    "level": "parsed",
    "evidence": [
      "Verified against a live Traccar 6.4 rig: a simulated device driven over the OsmAnd protocol produced positions that decode to schema-valid canonical events.",
      "Traccar position id used as a vendor event id; every position in the rig run received a distinct identity.",
      "Speed conversion from knots verified against values Traccar actually stored.",
      "Device uniqueId (an IMEI in the rig) verified absent from every canonical event.",
      "NOT forensics-ready: the pull reconciler is declared but untested, buffering and backfill behaviour has not been exercised, and timestamp behaviour has been checked only for the OsmAnd protocol rather than across the protocol range Traccar supports."
    ]
  }
}
